[{"baseline_job_sha256":"b2fdcd438fbae9ab1a65b56b5dbbf720e312cae788c650e81644593a09a27a58","baseline_renderer_sha256":"b60f0b146e3a1e0786cdfd9b9247602fa6f306fe2dd20d0e6dad2859dcb51a85","bridges":[],"contract_compatibility":"not_assessed_no_category_contract","effective_definition_json":"{\"applicability\":{\"en\":{\"reason\":\"English current-source migration; complete multilingual preflight deferred to Package D\",\"status\":\"applicable\"}},\"caption\":{\"case\":\"upper\",\"direction\":\"auto\",\"fallback\":null,\"key\":\"key_names.TIMELINE_ORDER\",\"mode\":\"translation\",\"template_key\":null,\"text\":\"\"},\"category\":\"Playlist\",\"color_assignment\":{\"exception\":null,\"id\":\"playlist.playlist-arrowverse-timeline-order.09b7e4b8.background\",\"origin\":\"historical\",\"parent\":null,\"relationship\":null},\"composer\":{\"avg_color\":false,\"avg_color_image\":null,\"base_color\":\"#2B8F40\",\"border\":false,\"border_color\":\"#FFFFFF\",\"border_width\":15,\"clean\":true,\"dom_color\":false,\"dom_color_image\":null,\"font\":\"fonts/BebasNeue-Regular.ttf\",\"font_color\":\"#FFFFFF\",\"font_size\":154,\"gradient\":1,\"logo\":\"logos_playlist/Arrowverse.png\",\"logo_offset\":-200,\"logo_resize\":1600,\"out_name\":\"Arrowverse (Timeline Order)\",\"text\":\"\",\"text_offset\":450,\"white_wash\":true},\"dependencies\":[],\"display_name\":\"Arrowverse (Timeline Order)\",\"generator\":null,\"id\":\"playlist.playlist-arrowverse-timeline-order.09b7e4b8\",\"languages\":[\"en\"],\"layout\":{\"kind\":\"captured_fit\",\"measurement\":{\"box\":[1600,1000],\"evidence_sha256\":\"d6b803c49440755d75be53f5fb4cbb969a4851569681cbf21e524aca1e971e38\",\"font_sha256\":\"08e4623805102d819f58601e46e345648846075e363b2ceb23313c2d1c83ec73\",\"maximum\":154,\"minimum\":100,\"point_size\":154,\"text\":\"TIMELINE ORDER\"}},\"output\":{\"directory\":\"playlist\",\"filename\":\"Arrowverse (Timeline Order).jpg\",\"remote_paths\":{\"en\":\"playlist/Arrowverse (Timeline Order).jpg\"}},\"overrides\":[],\"source\":{\"line\":5350,\"path\":\"create_default_posters.ps1\",\"row_sha256\":\"d223d67dc619a5955bb6fc9675a1706c78637d33c0c911348119602a05e9a495\"}}","evidence":{"approval_refs":[{"member_sha256":"0a96cbebf315263aa7b13415632ca50ccb897c96a4f63d59766bf0fbf9a80f93","record_sha256":"e15d85e3c81ad9e5f51ef3832e0b50026b30a09b0590a9eba07acf7d61615427","scope":"individual_font_or_visual"}],"native_report_sha256":"8755ddd72f51ea9daca09c3cbfe242a45ea4a99cef3c3c9d947b36e4caf96025","original_receipt_sha256":"54cc4028a4f46b8a8555bfde7ce8652bdc4a72246d3afde684dec122b525b7bc","output_sha256":"c793c1320b66f94d445828c5709f806c935739679b5d1c35d04de65dd758d8d3","owned_receipt_sha256":"54cc4028a4f46b8a8555bfde7ce8652bdc4a72246d3afde684dec122b525b7bc","response_receipt_sha256":"7d9fb197213fac0a5996965dde54bf41047c3ab7fc5852b8f5d7f3c2ae341830","worker_spec_sha256":"ba6117dad744a5b180dd5a88ea746219e71ed205b1c501ed4972492ff6673f69"},"family":null,"fingerprints":{"caption":"8404af3791ccd7e96d2dfc2bbcce9e86533d3bb57b9b22a1cc7161456fbfb22f","dependencies":"4f53cda18c2baa0c0354bb5f9a3ecbe5ed12ab4d8e11ba873c2f11161202b945","effective_definition":"6a6b982799bdcf7bea0db67fda3d1758ccfc1003ae9d7a54461483135845402d","exceptions":"672c02969cf08762e9ef2cd0cdaf0cebc5f9bc1a37c51759830e02b324268505","font":"5dabbc41b24ee1fd1add1f4ba57ba951f547b15870086baea86780656aff39e8","material_context":"06b62a8b6c6b0e1063a18b7dbe5e20089a095e18a892e66d7778988ce747e5e3","membership":"59ab959f1b6016046234b188d4ac24f797e83bdb69740851472bcd116c39e9bd","sources":"b328c1f9e57262ec05a11ae9fab33b062035b7ab574359277c4db7e6f95e6f2d","style":"00f8f1c0e3b95b77826db9cff93912b1821b8392df72100a6b4c69ca85f36c82","transformation":"5f5c6c723eeed33636b2b504f9988a1558ab9a67fe9ba73876692efe8774e0ef"},"historical_compatibility":"verified_unchanged_material","historical_exceptions":[{"code":"E04","evidence_sha256":"0773c9d40f40681b40293d51daaafe7568e6f9d413b8f567b94bf5babe6f3910"},{"code":"E13","evidence_sha256":"0773c9d40f40681b40293d51daaafe7568e6f9d413b8f567b94bf5babe6f3910"}],"identity":{"category":"Playlist","display_name":"Arrowverse (Timeline Order)","id":"playlist.playlist-arrowverse-timeline-order.09b7e4b8","kind":"item-identity","local_path":"defaults-en/playlist/Arrowverse (Timeline Order).jpg","public_path":"playlist/Arrowverse (Timeline Order).jpg","rendered_caption":"TIMELINE ORDER","schema_version":1,"semantic_member":null,"source":{"path":"logos_playlist/Arrowverse.png","sha256":"256787f4761e845b3a626ab2c23b943eb626ce0d006a98a92a16ded4fac01f8b"}},"job_id":"poster.20a61d96a5b75e65e0d76bb2","job_json":"{\"color_assignment\":{\"exception\":null,\"id\":\"playlist.playlist-arrowverse-timeline-order.09b7e4b8.background\",\"origin\":\"historical\",\"parent\":null,\"relationship\":null},\"definition_fingerprint\":\"db1a5e7725629ef22a02f39755d01b43b2c32b7f3765b14c71e4a89cf33ee15c\",\"dependencies\":[],\"generator_origin\":null,\"id\":\"poster.20a61d96a5b75e65e0d76bb2\",\"inputs\":[{\"path\":\"fonts/BebasNeue-Regular.ttf\",\"role\":\"font\",\"sha256\":\"08e4623805102d819f58601e46e345648846075e363b2ceb23313c2d1c83ec73\"},{\"path\":\"logos_playlist/Arrowverse.png\",\"role\":\"logo\",\"sha256\":\"256787f4761e845b3a626ab2c23b943eb626ce0d006a98a92a16ded4fac01f8b\"},{\"path\":\"fades/@bottom-top-fade.png\",\"role\":\"shared\",\"sha256\":\"79d93b7455a694820a4df4b27b4418ea0063af59400ed778fc66f83648daa110\"},{\"path\":\"fades/@bottom-up-fade.png\",\"role\":\"shared\",\"sha256\":\"7ed182e395a08b4035b687e6f0661029ef938f8027923ec9434ebcbc5d144cfd\"},{\"path\":\"fades/@center-out-fade.png\",\"role\":\"shared\",\"sha256\":\"6d36359197363ddc092fdaa8aa4590838b01b8a22c3bf4b6ded76d65bc85a87c\"},{\"path\":\"fades/@none.png\",\"role\":\"shared\",\"sha256\":\"5e89879184510e91e477d41c61bd86a0e9209e9ecc17909a7b0ee20427950cbc\"},{\"path\":\"fades/@top-down-fade.png\",\"role\":\"shared\",\"sha256\":\"cbbf0b235a893410e02977419c89ee6ad97df253cbaee382e01d088d2cce6b39\"},{\"path\":\"transparent.png\",\"role\":\"shared\",\"sha256\":\"64a0a1d637ff0687ccbcaeca31b8e6b7235002b1ee8528e7a60be6a7d636f1fc\"}],\"kind\":\"poster\",\"language\":\"en\",\"language_behavior\":{\"direction\":\"auto\",\"language\":\"en\"},\"layout_evidence\":{\"kind\":\"captured_fit\",\"measurement\":{\"box\":[1600,1000],\"evidence_sha256\":\"d6b803c49440755d75be53f5fb4cbb969a4851569681cbf21e524aca1e971e38\",\"font_sha256\":\"08e4623805102d819f58601e46e345648846075e363b2ceb23313c2d1c83ec73\",\"maximum\":154,\"minimum\":100,\"point_size\":154,\"text\":\"TIMELINE ORDER\"}},\"local_relative\":\"defaults-en/playlist/Arrowverse (Timeline Order).jpg\",\"parameters\":{\"avg_color\":false,\"avg_color_image\":null,\"base_color\":\"#2B8F40\",\"border\":false,\"border_color\":\"#FFFFFF\",\"border_width\":15,\"clean\":true,\"dom_color\":false,\"dom_color_image\":null,\"font\":\"fonts/BebasNeue-Regular.ttf\",\"font_color\":\"#FFFFFF\",\"font_size\":154,\"gradient\":1,\"logo\":\"logos_playlist/Arrowverse.png\",\"logo_offset\":-200,\"logo_resize\":1600,\"out_name\":\"Arrowverse (Timeline Order)\",\"text\":\"TIMELINE ORDER\",\"text_offset\":450,\"white_wash\":true},\"poster_id\":\"playlist.playlist-arrowverse-timeline-order.09b7e4b8\",\"raw_parameters\":{\"avg_color\":false,\"avg_color_image\":null,\"base_color\":\"#2B8F40\",\"border\":false,\"border_color\":\"#FFFFFF\",\"border_width\":15,\"clean\":true,\"dom_color\":false,\"dom_color_image\":null,\"font\":\"fonts/BebasNeue-Regular.ttf\",\"font_color\":\"#FFFFFF\",\"font_size\":154,\"gradient\":1,\"logo\":\"logos_playlist/Arrowverse.png\",\"logo_offset\":-200,\"logo_resize\":1600,\"out_name\":\"Arrowverse (Timeline Order)\",\"text\":\"TIMELINE ORDER\",\"text_offset\":450,\"white_wash\":true},\"remote_relative\":\"playlist/Arrowverse (Timeline Order).jpg\",\"render_fingerprint\":\"beb98a2a162fb675caf9eae97ddaf4930f67027cedb4ea44246e670351a85f86\",\"render_ready\":true,\"source\":{\"line\":5350,\"path\":\"create_default_posters.ps1\",\"row_sha256\":\"d223d67dc619a5955bb6fc9675a1706c78637d33c0c911348119602a05e9a495\"},\"status\":\"planned\",\"translation\":{\"fingerprint\":\"790c5e5d70230cc0034b9a2cb7757fb42251cd512cde9741608b2a94832fc0b5\",\"mode\":\"translation\",\"trace\":[{\"key\":\"key_names.TIMELINE_ORDER\",\"language\":\"en\",\"source_sha256\":\"5fe987030981e83c35fab37192240afd596febf7f6f4d205a9c024a272ff390f\",\"value_sha256\":\"b0b3b0c0130a31d2bc202968f503bba3fe29428ac1b5f2c278e3d2eb2bd205cc\"}]},\"variant\":\"base\"}","kind":"historical-output-adoption","maintainer_approval":"historical_record_found","observed_variant":"base","paired_identity":null,"publication_authorized":false,"schema_version":1,"source_identity":"source.2e9fa6cf84449c87419d4970c99cdaea","source_kind":"source_asset"},{"baseline_job_sha256":"b5957e83818d90bcf64136b39772f0e308f5dd5490247f95cebcb564c45a47bf","baseline_renderer_sha256":"b60f0b146e3a1e0786cdfd9b9247602fa6f306fe2dd20d0e6dad2859dcb51a85","bridges":[],"contract_compatibility":"not_assessed_no_category_contract","effective_definition_json":"{\"applicability\":{\"en\":{\"reason\":\"English current-source migration; complete multilingual preflight deferred to Package D\",\"status\":\"applicable\"}},\"caption\":{\"case\":\"upper\",\"direction\":\"auto\",\"fallback\":null,\"key\":\"key_names.TIMELINE_ORDER\",\"mode\":\"translation\",\"template_key\":null,\"text\":\"\"},\"category\":\"Playlist\",\"color_assignment\":{\"exception\":null,\"id\":\"playlist.playlist-marvel-cinematic-universe-timeline-order.d704757c.background\",\"origin\":\"historical\",\"parent\":null,\"relationship\":null},\"composer\":{\"avg_color\":false,\"avg_color_image\":null,\"base_color\":\"#AD2B2B\",\"border\":false,\"border_color\":\"#FFFFFF\",\"border_width\":15,\"clean\":true,\"dom_color\":false,\"dom_color_image\":null,\"font\":\"fonts/BebasNeue-Regular.ttf\",\"font_color\":\"#FFFFFF\",\"font_size\":154,\"gradient\":1,\"logo\":\"logos_playlist/Marvel Cinematic Universe.png\",\"logo_offset\":-200,\"logo_resize\":1600,\"out_name\":